{
  "app_version": "0.1.0",
  "counts": {
    "active_sources": 41,
    "products": 2,
    "reports": 95,
    "reports_by_state": {
      "emerging": 93,
      "faded": 0,
      "matured": 2,
      "parked": 0,
      "reinforced": 0,
      "tracking": 0
    },
    "requirement_sets": 1,
    "runs": 1,
    "sources": 43,
    "submissions": 3
  },
  "default_requirement_set_id": "nrw-corporate-plan",
  "generated_at": "2026-10-06T22:15:47Z",
  "instrument_version": "2026.10.0",
  "latest_run_id": "20261006T2155Z-6ae7",
  "latest_run_started_at": "2026-10-06T21:55:22.431740Z",
  "requirement_set_ids": [
    "nrw-corporate-plan"
  ],
  "rubric_version": "2026.10",
  "today": "2026-10-06"
}
